id,image,title,description,runtimeStr,genres,genreList,contentRating,imDbRating,imDbRatingVotes,metacriticRating,plot,stars,starList
tt15398776,https://m.media-amazon.com/images/M/MV5BMDBmYTZjNjUtN2M1MS00MTQ2LTk2ODgtNzc2M2QyZGE5NTVjXkEyXkFqcGdeQXVyNzAwMjU2MTY@._V1_Ratio0.6837_AL_.jpg,Oppenheimer,(2023),180 min,"Biography, Drama, History","[{'key': 'Biography', 'value': 'Biography'}, {'key': 'Drama', 'value': 'Drama'}, {'key': 'History', 'value': 'History'}]",R,8.8,162320,89,The story of American scientist J. Robert Oppenheimer and his role in the development of the atomic bomb.,"Christopher Nolan, Cillian Murphy, Emily Blunt, Matt Damon, Robert Downey Jr.","[{'id': 'tt15398776', 'name': 'Christopher Nolan'}, {'id': 'tt15398776', 'name': 'Cillian Murphy'}, {'id': 'tt15398776', 'name': 'Emily Blunt'}, {'id': 'tt15398776', 'name': 'Matt Damon'}, {'id': 'tt15398776', 'name': 'Robert Downey Jr.'}]"
tt9362722,https://m.media-amazon.com/images/M/MV5BMzI0NmVkMjEtYmY4MS00ZDMxLTlkZmEtMzU4MDQxYTMzMjU2XkEyXkFqcGdeQXVyMzQ0MzA0NTM@._V1_Ratio0.6837_AL_.jpg,Spider-Man: Across the Spider-Verse,(2023),140 min,"Animation, Action, Adventure","[{'key': 'Animation', 'value': 'Animation'}, {'key': 'Action', 'value': 'Action'}, {'key': 'Adventure', 'value': 'Adventure'}]",PG,8.9,191859,86,"Miles Morales catapults across the Multiverse, where he encounters a team of Spider-People charged with protecting its very existence. When the heroes clash on how to handle a new threat, Miles must redefine what it means to be a hero.","Joaquim Dos Santos, Kemp Powers, Justin K. Thompson, Shameik Moore, Hailee Steinfeld, Brian Tyree Henry, Luna Lauren Velez","[{'id': 'tt9362722', 'name': 'Joaquim Dos Santos'}, {'id': 'tt9362722', 'name': 'Kemp Powers'}, {'id': 'tt9362722', 'name': 'Justin K. Thompson'}, {'id': 'tt9362722', 'name': 'Shameik Moore'}, {'id': 'tt9362722', 'name': 'Hailee Steinfeld'}, {'id': 'tt9362722', 'name': 'Brian Tyree Henry'}, {'id': 'tt9362722', 'name': 'Luna Lauren Velez'}]"
tt0816692,https://m.media-amazon.com/images/M/MV5BZjdkOTU3MDktN2IxOS00OGEyLWFmMjktY2FiMmZkNWIyODZiXkEyXkFqcGdeQXVyMTMxODk2OTU@._V1_Ratio0.6837_AL_.jpg,Interstellar,(2014),169 min,"Adventure, Drama, Sci-Fi","[{'key': 'Adventure', 'value': 'Adventure'}, {'key': 'Drama', 'value': 'Drama'}, {'key': 'Sci-Fi', 'value': 'Sci-Fi'}]",PG-13,8.7,1946816,74,"When Earth becomes uninhabitable in the future, a farmer and ex-NASA pilot, Joseph Cooper, is tasked to pilot a spacecraft, along with a team of researchers, to find a new planet for humans.","Christopher Nolan, Matthew McConaughey, Anne Hathaway, Jessica Chastain, Mackenzie Foy","[{'id': 'tt0816692', 'name': 'Christopher Nolan'}, {'id': 'tt0816692', 'name': 'Matthew McConaughey'}, {'id': 'tt0816692', 'name': 'Anne Hathaway'}, {'id': 'tt0816692', 'name': 'Jessica Chastain'}, {'id': 'tt0816692', 'name': 'Mackenzie Foy'}]"
tt0468569,https://m.media-amazon.com/images/M/MV5BMTMxNTMwODM0NF5BMl5BanBnXkFtZTcwODAyMTk2Mw@@._V1_Ratio0.6837_AL_.jpg,The Dark Knight,(2008),152 min,"Action, Crime, Drama","[{'key': 'Action', 'value': 'Action'}, {'key': 'Crime', 'value': 'Crime'}, {'key': 'Drama', 'value': 'Drama'}]",PG-13,9.0,2747297,84,"When the menace known as the Joker wreaks havoc and chaos on the people of Gotham, Batman must accept one of the greatest psychological and physical tests of his ability to fight injustice.","Christopher Nolan, Christian Bale, Heath Ledger, Aaron Eckhart, Michael Caine","[{'id': 'tt0468569', 'name': 'Christopher Nolan'}, {'id': 'tt0468569', 'name': 'Christian Bale'}, {'id': 'tt0468569', 'name': 'Heath Ledger'}, {'id': 'tt0468569', 'name': 'Aaron Eckhart'}, {'id': 'tt0468569', 'name': 'Michael Caine'}]"
tt1375666,https://m.media-amazon.com/images/M/MV5BMjAxMzY3NjcxNF5BMl5BanBnXkFtZTcwNTI5OTM0Mw@@._V1_Ratio0.6837_AL_.jpg,Inception,(2010),148 min,"Action, Adventure, Sci-Fi","[{'key': 'Action', 'value': 'Action'}, {'key': 'Adventure', 'value': 'Adventure'}, {'key': 'Sci-Fi', 'value': 'Sci-Fi'}]",PG-13,8.8,2438171,74,"A thief who steals corporate secrets through the use of dream-sharing technology is given the inverse task of planting an idea into the mind of a C.E.O., but his tragic past may doom the project and his team to disaster.","Christopher Nolan, Leonardo DiCaprio, Joseph Gordon-Levitt, Elliot Page, Ken Watanabe","[{'id': 'tt1375666', 'name': 'Christopher Nolan'}, {'id': 'tt1375666', 'name': 'Leonardo DiCaprio'}, {'id': 'tt1375666', 'name': 'Joseph Gordon-Levitt'}, {'id': 'tt1375666', 'name': 'Elliot Page'}, {'id': 'tt1375666', 'name': 'Ken Watanabe'}]"
tt1745960,https://m.media-amazon.com/images/M/MV5BZWYzOGEwNTgtNWU3NS00ZTQ0LWJkODUtMmVhMjIwMjA1ZmQwXkEyXkFqcGdeQXVyMjkwOTAyMDU@._V1_Ratio0.6837_AL_.jpg,Top Gun: Maverick,(2022),130 min,"Action, Drama","[{'key': 'Action', 'value': 'Action'}, {'key': 'Drama', 'value': 'Drama'}]",PG-13,8.3,613027,78,"After thirty years, Maverick is still pushing the envelope as a top naval aviator, but must confront ghosts of his past when he leads TOP GUN's elite graduates on a mission that demands the ultimate sacrifice from those chosen to fly it.","Joseph Kosinski, Tom Cruise, Jennifer Connelly, Miles Teller, Val Kilmer","[{'id': 'tt1745960', 'name': 'Joseph Kosinski'}, {'id': 'tt1745960', 'name': 'Tom Cruise'}, {'id': 'tt1745960', 'name': 'Jennifer Connelly'}, {'id': 'tt1745960', 'name': 'Miles Teller'}, {'id': 'tt1745960', 'name': 'Val Kilmer'}]"
tt0111161,https://m.media-amazon.com/images/M/MV5BNDE3ODcxYzMtY2YzZC00NmNlLWJiNDMtZDViZWM2MzIxZDYwXkEyXkFqcGdeQXVyNjAwNDUxODI@._V1_Ratio0.6837_AL_.jpg,The Shawshank Redemption,(1994),142 min,Drama,"[{'key': 'Drama', 'value': 'Drama'}]",R,9.3,2772048,82,"Over the course of several years, two convicts form a friendship, seeking consolation and, eventually, redemption through basic compassion.","Frank Darabont, Tim Robbins, Morgan Freeman, Bob Gunton, William Sadler","[{'id': 'tt0111161', 'name': 'Frank Darabont'}, {'id': 'tt0111161', 'name': 'Tim Robbins'}, {'id': 'tt0111161', 'name': 'Morgan Freeman'}, {'id': 'tt0111161', 'name': 'Bob Gunton'}, {'id': 'tt0111161', 'name': 'William Sadler'}]"
tt0993846,https://m.media-amazon.com/images/M/MV5BMjIxMjgxNTk0MF5BMl5BanBnXkFtZTgwNjIyOTg2MDE@._V1_Ratio0.6837_AL_.jpg,The Wolf of Wall Street,(2013),180 min,"Biography, Comedy, Crime","[{'key': 'Biography', 'value': 'Biography'}, {'key': 'Comedy', 'value': 'Comedy'}, {'key': 'Crime', 'value': 'Crime'}]",R,8.2,1482586,75,"Based on the true story of Jordan Belfort, from his rise to a wealthy stock-broker living the high life to his fall involving crime, corruption and the federal government.","Martin Scorsese, Leonardo DiCaprio, Jonah Hill, Margot Robbie, Matthew McConaughey","[{'id': 'tt0993846', 'name': 'Martin Scorsese'}, {'id': 'tt0993846', 'name': 'Leonardo DiCaprio'}, {'id': 'tt0993846', 'name': 'Jonah Hill'}, {'id': 'tt0993846', 'name': 'Margot Robbie'}, {'id': 'tt0993846', 'name': 'Matthew McConaughey'}]"
tt0482571,https://m.media-amazon.com/images/M/MV5BMjA4NDI0MTIxNF5BMl5BanBnXkFtZTYwNTM0MzY2._V1_Ratio0.6837_AL_.jpg,The Prestige,(2006),130 min,"Drama, Mystery, Sci-Fi","[{'key': 'Drama', 'value': 'Drama'}, {'key': 'Mystery', 'value': 'Mystery'}, {'key': 'Sci-Fi', 'value': 'Sci-Fi'}]",PG-13,8.5,1378244,66,"After a tragic accident, two stage magicians in 1890s London engage in a battle to create the ultimate illusion while sacrificing everything they have to outwit each other.","Christopher Nolan, Christian Bale, Hugh Jackman, Scarlett Johansson, Michael Caine","[{'id': 'tt0482571', 'name': 'Christopher Nolan'}, {'id': 'tt0482571', 'name': 'Christian Bale'}, {'id': 'tt0482571', 'name': 'Hugh Jackman'}, {'id': 'tt0482571', 'name': 'Scarlett Johansson'}, {'id': 'tt0482571', 'name': 'Michael Caine'}]"
tt0082971,https://m.media-amazon.com/images/M/MV5BNTU2ODkyY2MtMjU1NC00NjE1LWEzYjgtMWQ3MzRhMTE0NDc0XkEyXkFqcGdeQXVyMjM4MzQ4OTQ@._V1_Ratio0.6837_AL_.jpg,Raiders of the Lost Ark,(1981),115 min,"Action, Adventure","[{'key': 'Action', 'value': 'Action'}, {'key': 'Adventure', 'value': 'Adventure'}]",PG,8.4,1005126,85,"In 1936, archaeologist and adventurer Indiana Jones is hired by the U.S. government to find the Ark of the Covenant before the Nazis can obtain its awesome powers.","Steven Spielberg, Harrison Ford, Karen Allen, Paul Freeman, John Rhys-Davies","[{'id': 'tt0082971', 'name': 'Steven Spielberg'}, {'id': 'tt0082971', 'name': 'Harrison Ford'}, {'id': 'tt0082971', 'name': 'Karen Allen'}, {'id': 'tt0082971', 'name': 'Paul Freeman'}, {'id': 'tt0082971', 'name': 'John Rhys-Davies'}]"
tt0068646,https://m.media-amazon.com/images/M/MV5BM2MyNjYxNmUtYTAwNi00MTYxLWJmNWYtYzZlODY3ZTk3OTFlXkEyXkFqcGdeQXVyNzkwMjQ5NzM@._V1_Ratio0.7041_AL_.jpg,The Godfather,(1972),175 min,"Crime, Drama","[{'key': 'Crime', 'value': 'Crime'}, {'key': 'Drama', 'value': 'Drama'}]",R,9.2,1929690,100,"Don Vito Corleone, head of a mafia family, decides to hand over his empire to his youngest son Michael. However, his decision unintentionally puts the lives of his loved ones in grave danger.","Francis Ford Coppola, Marlon Brando, Al Pacino, James Caan, Diane Keaton","[{'id': 'tt0068646', 'name': 'Francis Ford Coppola'}, {'id': 'tt0068646', 'name': 'Marlon Brando'}, {'id': 'tt0068646', 'name': 'Al Pacino'}, {'id': 'tt0068646', 'name': 'James Caan'}, {'id': 'tt0068646', 'name': 'Diane Keaton'}]"
tt0110912,https://m.media-amazon.com/images/M/MV5BNGNhMDIzZTUtNTBlZi00MTRlLWFjM2ItYzViMjE3YzI5MjljXkEyXkFqcGdeQXVyNzkwMjQ5NzM@._V1_Ratio0.6837_AL_.jpg,Pulp Fiction,(1994),154 min,"Crime, Drama","[{'key': 'Crime', 'value': 'Crime'}, {'key': 'Drama', 'value': 'Drama'}]",R,8.9,2127538,95,"The lives of two mob hitmen, a boxer, a gangster and his wife, and a pair of diner bandits intertwine in four tales of violence and redemption.","Quentin Tarantino, John Travolta, Uma Thurman, Samuel L. Jackson, Bruce Willis","[{'id': 'tt0110912', 'name': 'Quentin Tarantino'}, {'id': 'tt0110912', 'name': 'John Travolta'}, {'id': 'tt0110912', 'name': 'Uma Thurman'}, {'id': 'tt0110912', 'name': 'Samuel L. Jackson'}, {'id': 'tt0110912', 'name': 'Bruce Willis'}]"
tt4633694,https://m.media-amazon.com/images/M/MV5BMjMwNDkxMTgzOF5BMl5BanBnXkFtZTgwNTkwNTQ3NjM@._V1_Ratio0.6837_AL_.jpg,Spider-Man: Into the Spider-Verse,(2018),117 min,"Animation, Action, Adventure","[{'key': 'Animation', 'value': 'Animation'}, {'key': 'Action', 'value': 'Action'}, {'key': 'Adventure', 'value': 'Adventure'}]",PG,8.4,612114,87,Teen Miles Morales becomes the Spider-Man of his universe and must join with five spider-powered individuals from other dimensions to stop a threat for all realities.,"Bob Persichetti, Peter Ramsey, Rodney Rothman, Shameik Moore, Jake Johnson, Hailee Steinfeld, Mahershala Ali","[{'id': 'tt4633694', 'name': 'Bob Persichetti'}, {'id': 'tt4633694', 'name': 'Peter Ramsey'}, {'id': 'tt4633694', 'name': 'Rodney Rothman'}, {'id': 'tt4633694', 'name': 'Shameik Moore'}, {'id': 'tt4633694', 'name': 'Jake Johnson'}, {'id': 'tt4633694', 'name': 'Hailee Steinfeld'}, {'id': 'tt4633694', 'name': 'Mahershala Ali'}]"
tt0209144,https://m.media-amazon.com/images/M/MV5BZTcyNjk1MjgtOWI3Mi00YzQwLWI5MTktMzY4ZmI2NDAyNzYzXkEyXkFqcGdeQXVyNjU0OTQ0OTY@._V1_Ratio0.6837_AL_.jpg,Memento,(2000),113 min,"Mystery, Thriller","[{'key': 'Mystery', 'value': 'Mystery'}, {'key': 'Thriller', 'value': 'Thriller'}]",R,8.4,1273969,83,A man with short-term memory loss attempts to track down his wife's murderer.,"Christopher Nolan, Guy Pearce, Carrie-Anne Moss, Joe Pantoliano, Mark Boone Junior","[{'id': 'tt0209144', 'name': 'Christopher Nolan'}, {'id': 'tt0209144', 'name': 'Guy Pearce'}, {'id': 'tt0209144', 'name': 'Carrie-Anne Moss'}, {'id': 'tt0209144', 'name': 'Joe Pantoliano'}, {'id': 'tt0209144', 'name': 'Mark Boone Junior'}]"
tt0073195,https://m.media-amazon.com/images/M/MV5BMmVmODY1MzEtYTMwZC00MzNhLWFkNDMtZjAwM2EwODUxZTA5XkEyXkFqcGdeQXVyNTAyODkwOQ@@._V1_Ratio0.6837_AL_.jpg,Jaws,(1975),124 min,"Adventure, Mystery, Thriller","[{'key': 'Adventure', 'value': 'Adventure'}, {'key': 'Mystery', 'value': 'Mystery'}, {'key': 'Thriller', 'value': 'Thriller'}]",PG,8.1,632079,87,"When a killer shark unleashes chaos on a beach community off Cape Cod, it's up to a local sheriff, a marine biologist, and an old seafarer to hunt the beast down.","Steven Spielberg, Roy Scheider, Robert Shaw, Richard Dreyfuss, Lorraine Gary","[{'id': 'tt0073195', 'name': 'Steven Spielberg'}, {'id': 'tt0073195', 'name': 'Roy Scheider'}, {'id': 'tt0073195', 'name': 'Robert Shaw'}, {'id': 'tt0073195', 'name': 'Richard Dreyfuss'}, {'id': 'tt0073195', 'name': 'Lorraine Gary'}]"
tt0097576,https://m.media-amazon.com/images/M/MV5BY2Q0ODg4ZmItNDZiYi00ZWY5LTg2NzctNmYwZjA5OThmNzE1XkEyXkFqcGdeQXVyMjM4MzQ4OTQ@._V1_Ratio0.6837_AL_.jpg,Indiana Jones and the Last Crusade,(1989),127 min,"Action, Adventure","[{'key': 'Action', 'value': 'Action'}, {'key': 'Adventure', 'value': 'Adventure'}]",PG-13,8.2,785312,65,"In 1938, after his father goes missing while pursuing the Holy Grail, Indiana Jones finds himself up against the Nazis again to stop them from obtaining its powers.","Steven Spielberg, Harrison Ford, Sean Connery, Alison Doody, Denholm Elliott","[{'id': 'tt0097576', 'name': 'Steven Spielberg'}, {'id': 'tt0097576', 'name': 'Harrison Ford'}, {'id': 'tt0097576', 'name': 'Sean Connery'}, {'id': 'tt0097576', 'name': 'Alison Doody'}, {'id': 'tt0097576', 'name': 'Denholm Elliott'}]"
tt1345836,https://m.media-amazon.com/images/M/MV5BMTk4ODQzNDY3Ml5BMl5BanBnXkFtZTcwODA0NTM4Nw@@._V1_Ratio0.6837_AL_.jpg,The Dark Knight Rises,(2012),164 min,"Action, Drama, Thriller","[{'key': 'Action', 'value': 'Action'}, {'key': 'Drama', 'value': 'Drama'}, {'key': 'Thriller', 'value': 'Thriller'}]",PG-13,8.4,1757656,78,"Eight years after the Joker's reign of chaos, Batman is coerced out of exile with the assistance of the mysterious Selina Kyle in order to defend Gotham City from the vicious guerrilla terrorist Bane.","Christopher Nolan, Christian Bale, Tom Hardy, Anne Hathaway, Gary Oldman","[{'id': 'tt1345836', 'name': 'Christopher Nolan'}, {'id': 'tt1345836', 'name': 'Christian Bale'}, {'id': 'tt1345836', 'name': 'Tom Hardy'}, {'id': 'tt1345836', 'name': 'Anne Hathaway'}, {'id': 'tt1345836', 'name': 'Gary Oldman'}]"
tt0107290,https://m.media-amazon.com/images/M/MV5BMjM2MDgxMDg0Nl5BMl5BanBnXkFtZTgwNTM2OTM5NDE@._V1_Ratio0.6837_AL_.jpg,Jurassic Park,(1993),127 min,"Action, Adventure, Sci-Fi","[{'key': 'Action', 'value': 'Action'}, {'key': 'Adventure', 'value': 'Adventure'}, {'key': 'Sci-Fi', 'value': 'Sci-Fi'}]",PG-13,8.2,1024419,68,A pragmatic paleontologist touring an almost complete theme park on an island in Central America is tasked with protecting a couple of kids after a power failure causes the park's cloned dinosaurs to run loose.,"Steven Spielberg, Sam Neill, Laura Dern, Jeff Goldblum, Richard Attenborough","[{'id': 'tt0107290', 'name': 'Steven Spielberg'}, {'id': 'tt0107290', 'name': 'Sam Neill'}, {'id': 'tt0107290', 'name': 'Laura Dern'}, {'id': 'tt0107290', 'name': 'Jeff Goldblum'}, {'id': 'tt0107290', 'name': 'Richard Attenborough'}]"
tt0361748,https://m.media-amazon.com/images/M/MV5BOTJiNDEzOWYtMTVjOC00ZjlmLWE0NGMtZmE1OWVmZDQ2OWJhXkEyXkFqcGdeQXVyNTIzOTk5ODM@._V1_Ratio0.6837_AL_.jpg,Inglourious Basterds,(2009),153 min,"Adventure, Drama, War","[{'key': 'Adventure', 'value': 'Adventure'}, {'key': 'Drama', 'value': 'Drama'}, {'key': 'War', 'value': 'War'}]",R,8.3,1507160,69,"In Nazi-occupied France during World War II, a plan to assassinate Nazi leaders by a group of Jewish U.S. soldiers coincides with a theatre owner's vengeful plans for the same.","Quentin Tarantino, Brad Pitt, Diane Kruger, Eli Roth, Mélanie Laurent","[{'id': 'tt0361748', 'name': 'Quentin Tarantino'}, {'id': 'tt0361748', 'name': 'Brad Pitt'}, {'id': 'tt0361748', 'name': 'Diane Kruger'}, {'id': 'tt0361748', 'name': 'Eli Roth'}, {'id': 'tt0361748', 'name': 'Mélanie Laurent'}]"
tt0372784,https://m.media-amazon.com/images/M/MV5BOTY4YjI2N2MtYmFlMC00ZjcyLTg3YjEtMDQyM2ZjYzQ5YWFkXkEyXkFqcGdeQXVyMTQxNzMzNDI@._V1_Ratio0.6837_AL_.jpg,Batman Begins,(2005),140 min,"Action, Crime, Drama","[{'key': 'Action', 'value': 'Action'}, {'key': 'Crime', 'value': 'Crime'}, {'key': 'Drama', 'value': 'Drama'}]",PG-13,8.2,1517613,70,"After witnessing his parents' death, Bruce learns the art of fighting to confront injustice. When he returns to Gotham as Batman, he must stop a secret society that intends to destroy the city.","Christopher Nolan, Christian Bale, Michael Caine, Ken Watanabe, Liam Neeson","[{'id': 'tt0372784', 'name': 'Christopher Nolan'}, {'id': 'tt0372784', 'name': 'Christian Bale'}, {'id': 'tt0372784', 'name': 'Michael Caine'}, {'id': 'tt0372784', 'name': 'Ken Watanabe'}, {'id': 'tt0372784', 'name': 'Liam Neeson'}]"
tt10872600,https://m.media-amazon.com/images/M/MV5BZWMyYzFjYTYtNTRjYi00OGExLWE2YzgtOGRmYjAxZTU3NzBiXkEyXkFqcGdeQXVyMzQ0MzA0NTM@._V1_Ratio0.6837_AL_.jpg,Spider-Man: No Way Home,(2021),148 min,"Action, Adventure, Fantasy","[{'key': 'Action', 'value': 'Action'}, {'key': 'Adventure', 'value': 'Adventure'}, {'key': 'Fantasy', 'value': 'Fantasy'}]",PG-13,8.2,816000,71,"With Spider-Man's identity now revealed, Peter asks Doctor Strange for help. When a spell goes wrong, dangerous foes from other worlds start to appear, forcing Peter to discover what it truly means to be Spider-Man.","Jon Watts, Tom Holland, Zendaya, Benedict Cumberbatch, Jacob Batalon","[{'id': 'tt10872600', 'name': 'Jon Watts'}, {'id': 'tt10872600', 'name': 'Tom Holland'}, {'id': 'tt10872600', 'name': 'Zendaya'}, {'id': 'tt10872600', 'name': 'Benedict Cumberbatch'}, {'id': 'tt10872600', 'name': 'Jacob Batalon'}]"
tt0407887,https://m.media-amazon.com/images/M/MV5BMTI1MTY2OTIxNV5BMl5BanBnXkFtZTYwNjQ4NjY3._V1_Ratio0.6837_AL_.jpg,The Departed,(2006),151 min,"Crime, Drama, Thriller","[{'key': 'Crime', 'value': 'Crime'}, {'key': 'Drama', 'value': 'Drama'}, {'key': 'Thriller', 'value': 'Thriller'}]",R,8.5,1367691,85,An undercover cop and a mole in the police attempt to identify each other while infiltrating an Irish gang in South Boston.,"Martin Scorsese, Leonardo DiCaprio, Matt Damon, Jack Nicholson, Mark Wahlberg","[{'id': 'tt0407887', 'name': 'Martin Scorsese'}, {'id': 'tt0407887', 'name': 'Leonardo DiCaprio'}, {'id': 'tt0407887', 'name': 'Matt Damon'}, {'id': 'tt0407887', 'name': 'Jack Nicholson'}, {'id': 'tt0407887', 'name': 'Mark Wahlberg'}]"
tt0113277,https://m.media-amazon.com/images/M/MV5BYjZjNTJlZGUtZTE1Ny00ZDc4LTgwYjUtMzk0NDgwYzZjYTk1XkEyXkFqcGdeQXVyNjU0OTQ0OTY@._V1_Ratio0.6837_AL_.jpg,Heat,(1995),170 min,"Action, Crime, Drama","[{'key': 'Action', 'value': 'Action'}, {'key': 'Crime', 'value': 'Crime'}, {'key': 'Drama', 'value': 'Drama'}]",R,8.3,684294,76,A group of high-end professional thieves start to feel the heat from the LAPD when they unknowingly leave a clue at their latest heist.,"Michael Mann, Al Pacino, Robert De Niro, Val Kilmer, Jon Voight","[{'id': 'tt0113277', 'name': 'Michael Mann'}, {'id': 'tt0113277', 'name': 'Al Pacino'}, {'id': 'tt0113277', 'name': 'Robert De Niro'}, {'id': 'tt0113277', 'name': 'Val Kilmer'}, {'id': 'tt0113277', 'name': 'Jon Voight'}]"
tt1392214,https://m.media-amazon.com/images/M/MV5BMTg0NTIzMjQ1NV5BMl5BanBnXkFtZTcwNDc3MzM5OQ@@._V1_Ratio0.6837_AL_.jpg,Prisoners,(2013),153 min,"Crime, Drama, Mystery","[{'key': 'Crime', 'value': 'Crime'}, {'key': 'Drama', 'value': 'Drama'}, {'key': 'Mystery', 'value': 'Mystery'}]",R,8.1,757944,70,"When Keller Dover's daughter and her friend go missing, he takes matters into his own hands as the police pursue multiple leads and the pressure mounts.","Denis Villeneuve, Hugh Jackman, Jake Gyllenhaal, Viola Davis, Melissa Leo","[{'id': 'tt1392214', 'name': 'Denis Villeneuve'}, {'id': 'tt1392214', 'name': 'Hugh Jackman'}, {'id': 'tt1392214', 'name': 'Jake Gyllenhaal'}, {'id': 'tt1392214', 'name': 'Viola Davis'}, {'id': 'tt1392214', 'name': 'Melissa Leo'}]"
tt0477348,https://m.media-amazon.com/images/M/MV5BMjA5Njk3MjM4OV5BMl5BanBnXkFtZTcwMTc5MTE1MQ@@._V1_Ratio0.6837_AL_.jpg,No Country for Old Men,(2007),122 min,"Crime, Drama, Thriller","[{'key': 'Crime', 'value': 'Crime'}, {'key': 'Drama', 'value': 'Drama'}, {'key': 'Thriller', 'value': 'Thriller'}]",R,8.2,1011543,92,Violence and mayhem ensue after a hunter stumbles upon a drug deal gone wrong and more than two million dollars in cash near the Rio Grande.,"Ethan Coen, Joel Coen, Tommy Lee Jones, Javier Bardem, Josh Brolin, Woody Harrelson","[{'id': 'tt0477348', 'name': 'Ethan Coen'}, {'id': 'tt0477348', 'name': 'Joel Coen'}, {'id': 'tt0477348', 'name': 'Tommy Lee Jones'}, {'id': 'tt0477348', 'name': 'Javier Bardem'}, {'id': 'tt0477348', 'name': 'Josh Brolin'}, {'id': 'tt0477348', 'name': 'Woody Harrelson'}]"
tt0120737,https://m.media-amazon.com/images/M/MV5BN2EyZjM3NzUtNWUzMi00MTgxLWI0NTctMzY4M2VlOTdjZWRiXkEyXkFqcGdeQXVyNDUzOTQ5MjY@._V1_Ratio0.6837_AL_.jpg,The Lord of the Rings: The Fellowship of the Ring,(2001),178 min,"Action, Adventure, Drama","[{'key': 'Action', 'value': 'Action'}, {'key': 'Adventure', 'value': 'Adventure'}, {'key': 'Drama', 'value': 'Drama'}]",PG-13,8.8,1929755,92,A meek Hobbit from the Shire and eight companions set out on a journey to destroy the powerful One Ring and save Middle-earth from the Dark Lord Sauron.,"Peter Jackson, Elijah Wood, Ian McKellen, Orlando Bloom, Sean Bean","[{'id': 'tt0120737', 'name': 'Peter Jackson'}, {'id': 'tt0120737', 'name': 'Elijah Wood'}, {'id': 'tt0120737', 'name': 'Ian McKellen'}, {'id': 'tt0120737', 'name': 'Orlando Bloom'}, {'id': 'tt0120737', 'name': 'Sean Bean'}]"
tt0137523,https://m.media-amazon.com/images/M/MV5BMmEzNTkxYjQtZTc0MC00YTVjLTg5ZTEtZWMwOWVlYzY0NWIwXkEyXkFqcGdeQXVyNzkwMjQ5NzM@._V1_Ratio0.6837_AL_.jpg,Fight Club,(1999),139 min,Drama,"[{'key': 'Drama', 'value': 'Drama'}]",R,8.8,2208076,67,An insomniac office worker and a devil-may-care soap maker form an underground fight club that evolves into much more.,"David Fincher, Brad Pitt, Edward Norton, Meat Loaf, Zach Grenier","[{'id': 'tt0137523', 'name': 'David Fincher'}, {'id': 'tt0137523', 'name': 'Brad Pitt'}, {'id': 'tt0137523', 'name': 'Edward Norton'}, {'id': 'tt0137523', 'name': 'Meat Loaf'}, {'id': 'tt0137523', 'name': 'Zach Grenier'}]"
tt4154796,https://m.media-amazon.com/images/M/MV5BMTc5MDE2ODcwNV5BMl5BanBnXkFtZTgwMzI2NzQ2NzM@._V1_Ratio0.6837_AL_.jpg,Avengers: Endgame,(2019),181 min,"Action, Adventure, Drama","[{'key': 'Action', 'value': 'Action'}, {'key': 'Adventure', 'value': 'Adventure'}, {'key': 'Drama', 'value': 'Drama'}]",PG-13,8.4,1197420,78,"After the devastating events of Avengers: Infinity War (2018), the universe is in ruins. With the help of remaining allies, the Avengers assemble once more in order to reverse Thanos' actions and restore balance to the universe.","Anthony Russo, Joe Russo, Robert Downey Jr., Chris Evans, Mark Ruffalo, Chris Hemsworth","[{'id': 'tt4154796', 'name': 'Anthony Russo'}, {'id': 'tt4154796', 'name': 'Joe Russo'}, {'id': 'tt4154796', 'name': 'Robert Downey Jr.'}, {'id': 'tt4154796', 'name': 'Chris Evans'}, {'id': 'tt4154796', 'name': 'Mark Ruffalo'}, {'id': 'tt4154796', 'name': 'Chris Hemsworth'}]"
tt0172495,https://m.media-amazon.com/images/M/MV5BMDliMmNhNDEtODUyOS00MjNlLTgxODEtN2U3NzIxMGVkZTA1L2ltYWdlXkEyXkFqcGdeQXVyNjU0OTQ0OTY@._V1_Ratio0.6837_AL_.jpg,Gladiator,(2000),155 min,"Action, Adventure, Drama","[{'key': 'Action', 'value': 'Action'}, {'key': 'Adventure', 'value': 'Adventure'}, {'key': 'Drama', 'value': 'Drama'}]",R,8.5,1548156,67,A former Roman General sets out to exact vengeance against the corrupt emperor who murdered his family and sent him into slavery.,"Ridley Scott, Russell Crowe, Joaquin Phoenix, Connie Nielsen, Oliver Reed","[{'id': 'tt0172495', 'name': 'Ridley Scott'}, {'id': 'tt0172495', 'name': 'Russell Crowe'}, {'id': 'tt0172495', 'name': 'Joaquin Phoenix'}, {'id': 'tt0172495', 'name': 'Connie Nielsen'}, {'id': 'tt0172495', 'name': 'Oliver Reed'}]"
tt1853728,https://m.media-amazon.com/images/M/MV5BMjIyNTQ5NjQ1OV5BMl5BanBnXkFtZTcwODg1MDU4OA@@._V1_Ratio0.6837_AL_.jpg,Django Unchained,(2012),165 min,"Drama, Western","[{'key': 'Drama', 'value': 'Drama'}, {'key': 'Western', 'value': 'Western'}]",R,8.4,1616299,81,"With the help of a German bounty-hunter, a freed slave sets out to rescue his wife from a brutal plantation owner in Mississippi.","Quentin Tarantino, Jamie Foxx, Christoph Waltz, Leonardo DiCaprio, Kerry Washington","[{'id': 'tt1853728', 'name': 'Quentin Tarantino'}, {'id': 'tt1853728', 'name': 'Jamie Foxx'}, {'id': 'tt1853728', 'name': 'Christoph Waltz'}, {'id': 'tt1853728', 'name': 'Leonardo DiCaprio'}, {'id': 'tt1853728', 'name': 'Kerry Washington'}]"
tt0078748,https://m.media-amazon.com/images/M/MV5BOGQzZTBjMjQtOTVmMS00NGE5LWEyYmMtOGQ1ZGZjNmRkYjFhXkEyXkFqcGdeQXVyMjUzOTY1NTc@._V1_Ratio0.6837_AL_.jpg,Alien,(1979),117 min,"Horror, Sci-Fi","[{'key': 'Horror', 'value': 'Horror'}, {'key': 'Sci-Fi', 'value': 'Sci-Fi'}]",R,8.5,910898,89,The crew of a commercial spacecraft encounters a deadly lifeform after investigating an unknown transmission.,"Ridley Scott, Sigourney Weaver, Tom Skerritt, John Hurt, Veronica Cartwright","[{'id': 'tt0078748', 'name': 'Ridley Scott'}, {'id': 'tt0078748', 'name': 'Sigourney Weaver'}, {'id': 'tt0078748', 'name': 'Tom Skerritt'}, {'id': 'tt0078748', 'name': 'John Hurt'}, {'id': 'tt0078748', 'name': 'Veronica Cartwright'}]"
